,World Rank,Market Capital,Headquarters,Sectors,Annual Revenue,Annual Net Income,Total Assests,Total Employees,CEOs
287,270,50.93 Billion USD,USA,"Industries, Railway, Rail Transport, Freight Transport, Railway Operating Company, Transportation","NORFOLK SOUTHERN CORPORATION Annual Revenues for December-2019 ending is 11,296 Million USD","NORFOLK SOUTHERN CORPORATION Annual Net Income for December-2019 ending is 2,722 Million USD","NORFOLK SOUTHERN CORPORATION Total Assets as on June-2020 is 37,962 Million USD","20,156",James A. Squires
288,271,50.75 Billion USD,Japan,"Healthcare, Pharmaceutical, HealthCare Products",CHUGAI PHARMACEUTICAL Annual Revenues for March-2020 ending is 686.1 Billion JPY,CHUGAI PHARMACEUTICAL Annual Net Income for March-2020 ending is 157.5 Billion JPY,,"7,394",Tatsuro Kosaka
289,272,50.70 Billion USD,Canada,"Energy, Oil and Gas, Oil Refining, Electricity Generation, Power Generation, Retail, Petrochemicals, Lubricants, Oil Refining, Energy, Chemicals",SUNCOR ENERGY Annual Revenues for December-2019 ending is 38.34 Billion CAD,SUNCOR ENERGY Annual Net Income for December-2019 ending is 2.89 Billion CAD,,"12,591",Mark S. Little
290,273,50.49 Billion USD,UK,"Financial Services, Insurance, Asset Management",PRUDENTIAL Annual Revenue for year ending December-2019 is 94133 Million GBP,PRUDENTIAL Annual Net Profit for year ending December-2019 is 792 Million GBP,PRUDENTIAL Total Assets as on December-2019 is 454214 Million GBP,"41,671",Charles F. Lowrey
291,274,50.31 Billion USD,USA,"Real Estate, Data Centers, Cloud Services, Technology Hardware and Instruments, Technology, Consumer Services, Property Investments","EQUINIX Annual Revenues for December-2019 ending is 5,562 Million USD",EQUINIX Annual Net Income for December-2019 ending is 507.4 Million USD,"EQUINIX Total Assets as on June-2020 is 27,793 Million USD","8,700",Charles J. Meyers
292,275,50.29 Billion USD,USA,"Energy, Oil and Gas, Petroleum, Petrochemicals, Natural Gas Generation, Lubricants, Aviation Fuels, Oil Refining, Chemicals, Fuels","PHILLIPS 66 Annual Revenues for December-2019 ending is 107,293 Million USD","PHILLIPS 66 Annual Net Income for December-2019 ending is 3,076 Million USD","PHILLIPS 66 Total Assets as on June-2020 is 54,518 Million USD","14,300",Greg C. Garland
293,276,49.98 Billion USD,USA,"Consumer Cyclical, Hotels, Consumer Services","MARRIOTT INTERNATIONAL Annual Revenues for December-2019 ending is 20,972 Million USD","MARRIOTT INTERNATIONAL Annual Net Income for December-2019 ending is 1,273 Million USD","MARRIOTT INTERNATIONAL Total Assets as on June-2020 is 25,680 Million USD","121,000",Anthony Capuano
294,276,,USA,"Technology, Communication Services",,,,55,
295,276,,USA,"Internet or Mobile App Based Business, Rent / Lease Services, Consumer Services",AirBnB Annual Revenues for 2019 is 4.7 Billion USD,,,"6,300",
296,277,49.82 Billion USD,Singapore,"Financial Services, Banking Services",DBS GROUP HOLDINGS Annual Revenues for December-2019 ending is 14.54 Billion SGD,DBS GROUP HOLDINGS Annual Net Income for December-2019 ending is 6.39 Billion SGD,,"33,002",Piyush Gupta
297,278,49.82 Billion USD,USA,"Healthcare, Hospitals, HealthCare Products, Healthcare Service","HCA HEALTHCARE Annual Revenues for December-2019 ending is 51,336 Million USD","HCA HEALTHCARE Annual Net Income for December-2019 ending is 3,505 Million USD","HCA HEALTHCARE Total Assets as on June-2020 is 48,709 Million USD","280,000",Samuel N. Hazen
298,279,49.70 Billion USD,Russia,"Basic Materials, Mining, Metals, Nickel, Copper Mining, Platinum",MMC NORILSK NICKEL Annual Revenues for December-2019 ending is 13.56 Billion USD,MMC NORILSK NICKEL Annual Net Income for December-2019 ending is 5.78 Billion USD,,"75,901",Vladimir Potanin
299,280,49.60 Billion USD,USA,"Financial Services, Banking Services, Credit Cards, Technology, Insurance","AMERICAN INTERNATIONAL GROUP (AIG) Annual Revenues for December-2019 ending is 49,792 Million USD","AMERICAN INTERNATIONAL GROUP (AIG) Annual Net Income for December-2019 ending is 3,326 Million USD","AMERICAN INTERNATIONAL GROUP (AIG) Total Assets as on June-2020 is 569,388 Million USD","49,600",Brian Duperreault
300,281,49.44 Billion USD,USA,"Healthcare, Medical Equipment, Biotechnology, Capital Goods, Technology, Health Care Diagnostics","ILLUMINA Annual Revenues for December-2019 ending is 3,543 Million USD","ILLUMINA Annual Net Income for December-2019 ending is 1,002 Million USD","ILLUMINA Total Assets as on June-2020 is 7,248 Million USD","7,850",Francis deSouza
301,282,49.33 Billion USD,Sweden,"Industries, Capital Goods, Construction Equipment, Electrical Products, Machinery Manufacturing, Industry Machinery",ATLAS COPCO AB Annual Revenues for December-2019 ending is 103.75 Billion SEK,ATLAS COPCO AB Annual Net Income for December-2019 ending is 16.52 Billion SEK,,"40,000",Mats Rahmstrom
302,283,48.99 Billion USD,India,"Financial Services, Banking Services, Wealth Management, Credit Cards, Private Bank",ICICI BANK Consolidated Annual Revenues for March-2020 ending is 401.21 Billion INR,ICICI BANK Consolidated Annual Net Income for March-2020 ending is 112.25 Billion INR,"ICICI Bank Total Assets (Consolidated) as on Sep 2020 ending quarter is 1,476,013.70 Crores INR","131,232",Sandeep Bakhshi
303,284,48.91 Billion USD,USA,"Energy, Oil and Gas, Natural Gas Generation, Petrochemicals, Petroleum, Chemicals","EOG RESOURCES Annual Revenues for December-2019 ending is 17,122 Million USD","EOG RESOURCES Annual Net Income for December-2019 ending is 2,734 Million USD","EOG RESOURCES Total Assets as on June-2020 is 35,222 Million USD","2,900",William R. Thomas
304,285,48.91 Billion USD,USA,"Financial Services, Insurance, Asset Management","METLIFE Annual Revenues for December-2019 ending is 69,620 Million USD","METLIFE Annual Net Income for December-2019 ending is 5,899 Million USD",METLIFE Total Assets as on June-2020 is 768 Million USD,"46,500",Michel A. Khalaf
305,286,48.85 Billion USD,Australia,"Financial Services, Banking Services",ANZ BANKING GROUP Annual Revenues for September-2020 ending is 17.54 Billion AUD,ANZ BANKING GROUP Annual Net Income for September-2020 ending is 3.57 Billion AUD,1042.2 Billion AUD for Year ending September-2020,"37,506",Shayne Elliott
306,287,48.84 Billion USD,USA,"Healthcare, Medical Equipment, HealthCare Products","EDWARDS LIFESCIENCES CORPORATION Annual Revenues for December-2019 ending is 4,348 Million USD","EDWARDS LIFESCIENCES CORPORATION Annual Net Income for December-2019 ending is 1,047 Million USD","EDWARDS LIFESCIENCES CORPORATION Total Assets as on June-2020 is 6,424 Million USD","14,000",Michael A Mussallem
307,288,48.79 Billion USD,USA,"Financial Services, Insurance, Investments",AON Annual Revenues for December-2019 ending is 11.01 Billion USD,AON Annual Net Income for December-2019 ending is 0.78 Billion USD,,"50,000",Gregory C. Case
308,289,48.63 Billion USD,Japan,"Communication Services, Electronics, Technology Hardware and Instruments, Video Games / Mobile Games / Tech Games / Casino Games, Technology, Gaming","NINTENDO Annual Revenues for March-2019 ending is 1,200 Billion JPY",NINTENDO Annual Net Income for March-2019 ending is 194 Billion JPY,,"6,574",Shuntaro Furukawa
309,290,48.49 Billion USD,USA,"Healthcare, Insurance, Healthcare Service, HealthCare Products","HUMANA Annual Revenues for December-2019 ending is 64,888 Million USD","HUMANA Annual Net Income for December-2019 ending is 2,707 Million USD","HUMANA Total Assets as on June-2020 is 34,969 Million USD","48,700",Bruce D. Broussard
310,291,48.35 Billion USD,UK,"Communication Services, Software and IT, Software Products, Consumer Services, Publishing","RELX Annual Revenues for December-2019 ending is 7,874 Million GBP","RELX Annual Net Profit for December-2019 ending is 1,505 Million GBP",RELX Total Assets as on December-2019 is 19980 Million GBP,"33,200",Erik Engstrom
311,292,48.22 Billion USD,USA,"Industries, Waste and Trash Management, Environmental Services, Utilities","WASTE MANAGEMENT Annual Revenues for December-2019 ending is 15,455 Million USD","WASTE MANAGEMENT Annual Net Income for December-2019 ending is 1,670 Million USD","WASTE MANAGEMENT Total Assets as on June-2020 is 29,345 Million USD","44,900",James C. Fish Jr
312,293,48.02 Billion USD,USA,"Energy, Oil and Gas, Infrastructure, Gas Utilities, Utilities","KINDER MORGAN Annual Revenues for December-2019 ending is 13,209 Million USD","KINDER MORGAN Annual Net Income for December-2019 ending is 2,190 Million USD","KINDER MORGAN Total Assets as on June-2020 is 71,784 Million USD","10,524",Steven J. Kean
313,294,47.99 Billion USD,Netherlands,"Financial Services, Banking Services",ING GROUP Annual Revenues for December-2019 ending is 16.96 Billion EUR,ING GROUP Annual Net Income for December-2019 ending is 3.90 Billion EUR,,"55,901",Steven van Rijswijk
314,295,47.93 Billion USD,Brazil,"Financial Services, Banking Services, Asset Management, Insurance",BANCO SANTANDER BRASIL SA Annual Revenues for December-2019 ending is 46.34 Billion BRL,BANCO SANTANDER BRASIL SA Annual Net Income for December-2019 ending is 7.96 Billion BRL,,"44,599",Sergio Rial
315,296,47.92 Billion USD,China,"Consumer Cyclical, eCommerce, Internet or Mobile App Based Business, Software and IT, Retail",PINDUODUO Annual Revenues for December-2020 ending is 59.49 Billion CNY,PINDUODUO Annual Net Loss for December-2020 ending is (-)7.18 Billion CNY (Loss),158.91 Billion CNY as on December-2020,"7,986",Colin Huang Zheng
316,297,47.73 Billion USD,USA,"Financial Services, Banking Services, Insurance, Credit Cards","CAPITAL ONE FINANCIAL CORPORATION Annual Revenues for December-2019 ending is 27,831 Million USD","CAPITAL ONE FINANCIAL CORPORATION Annual Net Income for December-2019 ending is 5,192 Million USD","CAPITAL ONE FINANCIAL CORPORATION Total Assets as on June-2020 is 421,296 Million USD","51,985",Richard Fairbank
317,298,47.72 Billion USD,Germany,"Industries, Courier, Logistics, Freight Transport",DEUTSCHE POST AG Annual Revenues for December-2019 ending is 63.34 Billion EUR,DEUTSCHE POST AG Annual Net Income for December-2019 ending is 2.62 Billion EUR,,"571,974",Frank Appel
318,299,47.67 Billion USD,Germany,"Healthcare, Medical Equipment, HealthCare Products, Technology, Health Care Diagnostics",SIEMENS HEALTHINEERS AG Annual Revenues for September-2019 ending is 14.52 Billion EUR,SIEMENS HEALTHINEERS AG Annual Net Income for September-2019 ending is 1.56 Billion EUR,,"52,000",
319,300,47.52 Billion USD,China,"Communication Services, Internet or Mobile App Based Business, Video Games / Mobile Games / Tech Games / Casino Games, Gaming, Software and IT, Software Products, Business Services",NETEASE Annual Revenues for December-2019 ending is 59.24 Billion CNY,NETEASE Annual Net Income for December-2019 ending is 21.23 Billion CNY,,"28,239",Ding Lei
320,301,47.44 Billion USD,France,"Consumer Defensive, Beverages, Alcoholic Beverages, FMCG",PERNOD RICARD Annual Revenues for June-2020 ending is 8.45 Billion EUR,PERNOD RICARD Annual Net Income for June-2020 ending is 329 Million EUR,"31,525 Million EUR as on June-2020","19,140",Alexandre Ricard
321,302,47.21 Billion USD,USA,"Basic Materials, Chemicals, Plastics / Plastic Products, Agriculture Products, Adhesives","DUPONT DE NEMOURS Annual Revenues for December-2019 ending is 21,512 Million USD",DUPONT DE NEMOURS Annual Net Income for December-2019 ending is 498 Million USD,"DUPONT DE NEMOURS Total Assets as on June-2020 is 66,753 Million USD","34,000",Edward D. Breen
322,303,47.00 Billion USD,USA,"Industries, Electrical Products, Electronics, Energy, Industry Machinery","EMERSON ELECTRIC COMPANY Annual Revenues for September-2019 ending is 18,372 Million USD","EMERSON ELECTRIC COMPANY Annual Net Income for September-2019 ending is 2,306 Million USD","EMERSON ELECTRIC COMPANY Total Assets as on June-2020 is 21,730 Million USD","86,700",David Farr
323,304,46.98 Billion USD,China,"Financial Services, Insurance",CHINA PACIFIC INSURANCE GROUP (CPIC) Annual Revenues for December-2019 ending is 384.85 Billion CNY,CHINA PACIFIC INSURANCE GROUP (CPIC) Annual Net Income for December-2019 ending is 27.74 Billion CNY,,"111,247",Kong Qingwei
324,305,46.91 Billion USD,Canada,"Technology, Software and IT, Software Products, Cloud Services, eCommerce, Internet or Mobile App Based Business","SHOPIFY Annual Revenues for December-2020 ending is 2,929 Million USD",SHOPIFY Annual Net Income for December-2020 ending is 319 Million USD,"7,462 Million USD as on Sep-2020","7,000",Tobias Lutke
325,306,46.83 Billion USD,USA,"Utilities, Electricity Generation, Electric Utilities, Utilities, Power Generation","AMERICAN ELECTRIC POWER COMPANY Annual Revenues for December-2019 ending is 15,561 Million USD","AMERICAN ELECTRIC POWER COMPANY Annual Net Income for December-2019 ending is 1,921 Million USD","AMERICAN ELECTRIC POWER COMPANY Total Assets as on June-2020 is 77,805 Million USD","16,787",Nick Akins
326,307,46.65 Billion USD,Italy,"Financial Services, Banking Services",INTESA SANPAOLO Annual Revenues for December-2019 ending is 31.71 Billion EUR,INTESA SANPAOLO Annual Net Income for December-2019 ending is 4.18 Billion EUR,,"105,615",Carlo Messina
327,308,46.58 Billion USD,Bermuda,"Industries, Conglomerate, Automobile, Real Estate, Financial Services, Insurance, Hotels, Shipping, Travel and Transport, Restaurants, Retail, Infrastructure",JARDINE MATHESON HOLDINGS Annual Revenues for December-2019 : 40.92 Billion USD,JARDINE MATHESON HOLDINGS Annual Net Income for December-2019 : 2.83 Billion USD,,"403,000",Benjamin William Keswick
328,309,46.56 Billion USD,USA,"Consumer Defensive, FMCG, Personal Care Products, Consumer Durables","KIMBERLY-CLARK CORPORATION Annual Revenues for December-2019 ending is 18,450 Million USD","KIMBERLY-CLARK CORPORATION Annual Net Income for December-2019 ending is 2,157 Million USD","KIMBERLY-CLARK CORPORATION Total Assets as on June-2020 is 16,173 Million USD","46,000",Michael D. Hsu
329,310,46.50 Billion USD,USA,"Financial Services, Banking Services, Wealth Management, Asset Management","BANK OF NEW YORK MELLON CORPORATION Annual Revenues for December-2019 ending is 16,009 Million USD","BANK OF NEW YORK MELLON CORPORATION Annual Net Income for December-2019 ending is 4,441 Million USD","BANK OF NEW YORK MELLON CORPORATION Total Assets as on June-2020 is 442,316 Million USD","48,500",Thomas P Gibbons
330,311,46.42 Billion USD,Switzerland,"Financial Services, Banking Services, Asset Management",UBS GROUP AG Annual Revenues for December-2019 ending is 28.94 Billion USD,UBS GROUP AG Annual Net Income for December-2019 ending is 4.30 Billion USD,,"71,551",Sergio Ermotti
331,312,45.83 Billion USD,China,"Financial Services, Banking Services",PING AN BANK Annual Revenues for December-2019 ending is 137.98 Billion CNY,PING AN BANK Annual Net Income for December-2019 ending is 28.19 Billion CNY,,"38,600",XIE Yonglin
332,313,45.62 Billion USD,Hong Kong,"Consumer Defensive, Beverages, Alcoholic Beverages, FMCG, Beer","BUDWEISER BREWING COMPANY APAC Annual Revenues as on December-2019 ending period is 1,619 Million USD",BUDWEISER BREWING COMPANY APAC Annual Net Income as on December-2019 ending period is 235 Million USD,,"28,546",Jan Craps
333,314,45.57 Billion USD,Macao,"Consumer Cyclical, Real Estate, Casinos, Hotels, Entertainment","SANDS CHINA Annual Revenues as on December-2019 ending period is 8,808 Million USD","SANDS CHINA Annual Net Income as on December-2019 ending period is 2,033 Million USD",,"26,186",Sheldon Adelson
334,315,45.20 Billion USD,USA,"Financial Services, Consulting Services, Investments, Stock Markets, Trading, Capital Markets","MOODY'S CORPORATION Annual Revenues for December-2019 ending is 4,829 Million USD","MOODY'S CORPORATION Annual Net Income for December-2019 ending is 1,422 Million USD","MOODY'S CORPORATION Total Assets as on June-2020 is 11,298 Million USD","11,490",Raymond W. McDaniel Jr
335,316,45.10 Billion USD,Switzerland,"Consumer Cyclical, Luxury Goods, Watches, Leather Products, Clothing, Readymade Clothing, Pens & Stationery, Consumer Goods, Fashion and Luxury Goods","COMPAGNIE FINANCIERE RICHEMONT SA Annual Revenues as on Mar 2020 ending period is 14,238 Million EUR",COMPAGNIE FINANCIERE RICHEMONT SA Annual Net Income as on Mar 2020 ending period is 933 Million EUR,,"35,000",Jerome Lambert
336,317,45.06 Billion USD,USA,"Communication Services, Software and IT, Software Products, Video Games / Mobile Games / Tech Games / Casino Games, Gaming, Entertainment, Technology","ACTIVISION BLIZZARD Annual Revenues as on December-2019 ending period is 6,489 Million USD","ACTIVISION BLIZZARD Annual Net Income as on December-2019 ending period is 1,503 Million USD","ACTIVISION BLIZZARD Total Assets as on June-2020 is 20,220 Million USD","9,500",Bobby Kotick
337,318,45.01 Billion USD,Japan,"Consumer Cyclical, Travel and Transport, Tourism, Entertainment, Leisure",ORIENTAL LAND Annual Revenues for March-2019 ending is 525.6 Billion JPY,ORIENTAL LAND Annual Net Income for March-2019 ending is 90.2 Billion JPY,,"8,034",Toshio Kagami
338,319,44.98 Billion USD,USA,"Technology, Electronics, Semiconductors, Power Systems, Power Generation","ANALOG DEVICES Annual Revenues as on Oct 2019 ending period is 5,991 Million USD","ANALOG DEVICES Annual Net Income as on Oct 2019 ending period is 1,359 Million USD",,"15,900",Vincent Roche
339,320,44.92 Billion USD,UAE,"Banking Services, Financial Services",FIRST ABU DHABI BANK FIRST ABU DHABI BANK Annual Revenues as on December-2019 ending is 5.5 Billion USD,,,"5,451",Hana Al Rostamani
340,321,44.92 Billion USD,USA,"Real Estate, Property Investments, Consumer Services, Investments","PUBLIC STORAGE Annual Revenues as on December-2019 ending period is 2,847 Million USD","PUBLIC STORAGE Annual Net Income as on December-2019 ending period is 1,272 Million USD",,"5,400",Joseph D. Russell Jr
341,322,44.91 Billion USD,Japan,"Basic Materials, Chemicals","SHIN-ETSU CHEMICAL Annual Revenues for March-2019 ending is 1,594 Billion JPY",SHIN-ETSU CHEMICAL Annual Net Income for March-2019 ending is 309.1 Billion JPY,,"24,069",Yasuhiko Saito
342,323,44.83 Billion USD,Canada,"Communication Services, Telecom, Mobile Services, Fixed Line Service, Internet Providers, Television Services, Radio Broadcasting, Media, Utilities, Telecom Equipment, Advertising, Broadcasting",BCE (Bell Canada Enterprises) Annual Revenues for December-2019 ending is 23.96 Billion CAD,BCE (Bell Canada Enterprises) Annual Net Income for December-2019 ending is 3.19 Billion CAD,,"52,100",Mirko Bibic
343,324,44.70 Billion USD,India,"Financial Services, Banking Services",KOTAK MAHINDRA BANK Consolidated Annual Revenues for March-2020 ending is 502.99 Billion INR,KOTAK MAHINDRA BANK Consolidated Annual Net Income for March-2020 ending is 86.07 Billion INR,,"71,000",Uday Kotak
344,325,44.64 Billion USD,Hong Kong,"Real Estate, Infrastructure, Construction, Property Investments, Conglomerate, Construction, Investments","SUN HUNG KAI PROPERTIES Annual Revenues as on Jun 2020 ending period is 82,653 Million HKD","SUN HUNG KAI PROPERTIES Annual Net Income as on Jun 2020 ending period is 23,521 Million HKD",,"39,500",Raymond Kwok
345,326,44.42 Billion USD,Saudi Arabia,"Financial Services, Banking Services",AL RAJHI BANKING AND INVESTMENT CORPORATION Annual Revenues for December-2019 ending is 19.46 Billion SAR,"AL RAJHI BANKING AND INVESTMENT CORPORATION Annual Net Income for December-2019 ending is 10,159 Million SAR","384,087 Millions SAR as on 2019","13,146",Waleed A. Al-Mogbel
346,326,,Netherlands,"Professional Services, Consulting Services, Business Services, Accounting and Auditing",KPMG Annual Revenues for 2019 is 29.75 Billion USD,,,"219,281",
347,327,44.41 Billion USD,USA,"Utilities, Electricity Generation, Energy, Nuclear Power, Renewable Energy, Solar Power, Wind Power, Electric Utilities, Power Generation","EXELON CORPORATION Annual Revenues as on December-2019 ending period is 34,438 Million USD","EXELON CORPORATION Annual Net Income as on December-2019 ending period is 2,936 Million USD","EXELON CORPORATION Total Assets as on June-2020 is 126,313 Million USD","32,340",Christopher M. Crane
348,328,44.41 Billion USD,USA,"Industries, Electronics, Technology Hardware and Instruments, Communications Equipment, Networking Products / Solutions, Automation, Robotics, Marine Systems, Space Products, Technology, Machinery Manufacturing, Capital Goods, Manufacturing, Aerospace and Defense","L3HARRIS TECHNOLOGIES Annual Revenues as on December-2019 ending period is 12,856 Million USD","L3HARRIS TECHNOLOGIES Annual Net Income as on December-2019 ending period is 1,333 Million USD","L3HARRIS TECHNOLOGIES Total Assets as on March-2020 is 11,107 Million USD","48,000",William M. Bill Brown
349,329,44.35 Billion USD,USA,"Technology, Semiconductors, Electronics, Technology Hardware and Instruments, Processors / Chips","LAM RESEARCH CORPORATION Annual Revenues as on June 2020 ending period is 10,044 Million USD","LAM RESEARCH CORPORATION Annual Net Income as on June 2020 ending period is 2,251 Million USD","LAM RESEARCH CORPORATION Total Assets as on June-2020 is 14,559 Million USD","11,300",Timothy M. Archer
350,330,44.33 Billion USD,China,"Basic Materials, Cement, Construction Materials",ANHUI CONCH CEMENT COMPANY Annual Revenues for December-2019 ending is 157.03 Billion CNY,ANHUI CONCH CEMENT COMPANY Annual Net Income for December-2019 ending is 33.59 Billion CNY,,"47,486",Bin Wu
351,331,44.28 Billion USD,China,"Technology, Electronics, Cameras & Accessories, Network Hardware and Software, Networking Products / Solutions, Video Making Products, Computers Hardware",HANGZHOU HIKVISION DIGITAL TECHNOLOGY Annual Revenues for December-2019 ending is 57.66 Billion CNY,HANGZHOU HIKVISION DIGITAL TECHNOLOGY Annual Net Income for December-2019 ending is 12.41 Billion CNY,,"40,000",Hongjia Gong
352,332,44.28 Billion USD,Netherlands,"Healthcare, Electronics, Medical Equipment, Lighting Products, Audio & Video Systems, Energy, Consumer Electronics, Technology, Health Care Diagnostics","PHILIPS Annual Revenues as on December-2019 ending period is 19,481 Million EUR","PHILIPS Annual Net Income as on December-2019 ending period is 1,167 Million EUR","27,713 Million EUR as on Dec-2020","81,592",Frans van Houten
353,333,44.00 Billion USD,Sweden,"Financial Services, Investments, Asset Management",INVESTOR AB (PUBL) Annual Revenues as on December-2019 ending period is 141.6 Billion SEK,INVESTOR AB (PUBL) Annual Net Income as on December-2019 ending period is 101.2 Billion SEK,,89,Johan Forssell
354,334,43.85 Billion USD,China,"Financial Services, Insurance",PICC GROUP (PEOPLE'S INSURANCE COMPANY (GROUP) OF CHINA) Annual Revenues for December-2019 ending is 529.57 Billion CNY,PICC GROUP (PEOPLE'S INSURANCE COMPANY (GROUP) OF CHINA) Annual Net Income for December-2019 ending is 22.13 Billion CNY,,"198,951",Jianjun Zhang
355,335,43.80 Billion USD,India,"Technology, Software and IT, Software Products, Software Consulting Services, Software Outsourcing Services, Artificial Intelligence, Cloud Services, Internet of Things, Automation, Robotics, Consulting Services, Outsourcing and Staffing",INFOSYS Consolidated Annual Revenues for March-2020 ending is 907.91 Billion INR,INFOSYS Consolidated Annual Net Income for March-2020 ending is 166.39 Billion INR,"Infosys Consolidated Total Assets as on Sep-2020 ending is 98,578 Crores INR","292,067",Salil Parekh
356,336,43.73 Billion USD,Hong Kong,"Real Estate, Construction, Property Investments, Infrastructure, Construction, Investments",CHINA OVERSEAS LAND AND INVESTMENT Annual Revenues as on Dec 2019 ending period is 163.6 Million CNY,CHINA OVERSEAS LAND AND INVESTMENT Annual Net Income as on Dec 2019 ending period is 41.6 Million CNY,,"6,200",Zhang Zhichao
357,337,43.38 Billion USD,Denmark,"Utilities, Electricity Generation, Power Generation, Energy, Electric Utilities, Renewable Energy",ORSTED A/S Annual Revenues as on December-2019 ending period is 59.9 Billion DKK,ORSTED A/S Annual Net Income as on December-2019 ending period is 6.5 Billion DKK,,"6,429",Henrik Poulsen
358,338,43.38 Billion USD,USA,"Consumer Defensive, Food Products, Food Service, Retail, Consumer Non Durables, Food Chains / Distributor","SYSCO CORPORATION Annual Revenues as on June 2020 ending period is 52,893 Million USD",SYSCO CORPORATION Annual Net Income as on June 2020 ending period is 215 Million USD,"SYSCO CORPORATION Total Assets as on June-2020 is 22,628 Million USD","57,000",Kevin Hourican
359,339,43.30 Billion USD,Japan,"Healthcare, Pharmaceutical, Medical Equipment, HealthCare Products",DAIICHI SANKYO COMPANY Annual Revenues for March-2019 ending is 929.7 Billion JPY,DAIICHI SANKYO COMPANY Annual Net Income for March-2019 ending is 93.4 Billion JPY,,"15,350",Sunao Manabe
360,340,43.27 Billion USD,UK,"Utilities, Gas Utilities, Electric Utilities, Oil and Gas",NATIONAL GRID TRANSCO Annual Revenue for year ending March-2020 is 14540 Million GBP,NATIONAL GRID TRANSCO Annual Net Profit for year ending March-2020 is 1265 Million GBP,NATIONAL GRID TRANSCO Total Assets as on March-2020 is 67089 Million GBP,"23,683",John Pettigrew
361,341,43.20 Billion USD,USA,"Healthcare, Medical Equipment, Pharmaceutical, HealthCare Products",BAXTER INTERNATIONAL Annual Revenues for period ending December-2019 : 11.36 Billion USD,BAXTER INTERNATIONAL Annual Net Income for period ending December-2019 : 1 Billion USD,"BAXTER INTERNATIONAL Total Assets as on June-2020 is 19,465 Million USD","50,000",Jose E. Almeida
362,342,43.08 Billion USD,Argentina,"Consumer Defensive, Beverages, Alcoholic Beverages, Wine",BODEGAS ESMERALDA Annual Revenues as on Mar 2020 ending period is 159.6 Million USD,BODEGAS ESMERALDA Annual Net Income as on Mar 2020 ending period is 13.86 Million USD,,,
