,World Rank,Market Capital,Headquarters,Sectors,Annual Revenue,Annual Net Income,Total Assests,Total Employees,CEOs
211,198,63.10 Billion USD,USA,"Healthcare, Medical Equipment, HealthCare Products","BOSTON SCIENTIFIC CORPORATION Annual Revenues for December-2019 ending is 10,735 Million USD","BOSTON SCIENTIFIC CORPORATION Annual Net Income for December-2019 ending is 4,700 Million USD","BOSTON SCIENTIFIC CORPORATION Total Assets as on June-2020 is 30,823 Million USD","38,000",Michael F. Mahoney
212,199,63.05 Billion USD,Spain,"Utilities, Electric Utilities, Energy",IBERDROLA Annual Revenues for December-2019 ending is 36.43 Billion EUR,IBERDROLA Annual Net Income for December-2019 ending is 3.40 Billion EUR,,"35,637",Jose Ignacio Sanchez Galan
213,200,62.84 Billion USD,Ireland,"Healthcare, Pharmaceutical, HealthCare Products, Biotechnology, Technology",ALLERGAN Annual Revenues for 2019-DEC ending is 16.08 Billion USD,ALLERGAN Annual Net Loss for 2019-DEC ending is -5.27 Billion USD (Loss),,"17,400",Brenton L. Saunders
214,200,,USA,"Retail, Super Markets, Hypermarkets",Publix Annual Revenue for the fiscal year ended Dec 2019 was 38.1 billion USD,Publix Annual Net Income for the fiscal year ended Dec 2019 was 3 billion USD,,"197,000",
215,201,62.46 Billion USD,USA,"Financial Services, Banking Services, Brokerage Services, Asset Management, Investments, Stock Markets, Trading, Capital Markets","THE CHARLES SCHWAB CORPORATION Annual Revenues for December-2019 ending is 10,721 Million USD","THE CHARLES SCHWAB CORPORATION Annual Net Income for December-2019 ending is 3,704 Million USD","THE CHARLES SCHWAB CORPORATION Total Assets as on June-2020 is 400,484 Million USD","32,000",Paul V. Woolway
216,202,62.23 Billion USD,Japan,"Industries, Internet or Mobile App Based Business, Consulting Services, Technology, Software and IT, Software Products, Outsourcing and Staffing","RECRUIT HOLDINGS Annual Revenues for March-2019 ending is 2,310 Billion JPY",RECRUIT HOLDINGS Annual Net Income for March-2019 ending is 174.2 Billion JPY,,"45,856",Masumi Minegishi
217,203,62.11 Billion USD,Switzerland,"Financial Services, Insurance",ZURICH INSURANCE GROUP AG Annual Revenues for December-2019 ending is 72.08 Billion USD,ZURICH INSURANCE GROUP AG Annual Net Income for December-2019 ending is 4.15 Billion USD,,"55,089",Mario Greco
218,204,62.00 Billion USD,USA,"Industries, Defense Products, Electronics, Missiles, Weapons, Sensors, Machinery Manufacturing, Capital Goods, Manufacturing","RAYTHEON COMPANY Annual Revenues for 2019-DEC ending is 29,176 Million USD","RAYTHEON COMPANY Annual Net Income for 2019-DEC ending is 3,343 Million USD","RAYTHEON COMPANY Total Assets as on June-2020 is 161,517 Million USD","67,000",Thomas A. Kennedy
219,205,61.70 Billion USD,USA,"Technology, Semiconductors, Electronics, Technology Hardware and Instruments, Memory Products","MICRON TECHNOLOGY Annual Revenues for August-2019 ending is 23,406 Million USD","MICRON TECHNOLOGY Annual Net Income for August-2019 ending is 6,313 Million USD","MICRON TECHNOLOGY Total Assets as on May-2020 is 52,005 Million USD","40,000",Sanjay Mehrotra
220,206,61.58 Billion USD,Japan,"Consumer Cyclical, Retail, Clothing","FAST RETAILING Annual Revenues for August-2019 ending is 2,290.5 Billion JPY",FAST RETAILING Annual Net Income for August-2019 ending is 162.5 Billion JPY,,"57,727",Tadashi Yanai
221,207,61.47 Billion USD,USA,"Energy, Oil and Gas, Oil Refining, Petrochemicals, Gas Utilities, Natural Gas Generation, Utilities, Chemicals","ENTERPRISE PRODUCTS PARTNERS Annual Revenues for December-2019 ending is 32,789 Million USD","ENTERPRISE PRODUCTS PARTNERS Annual Net Income for December-2019 ending is 4,591 Million USD","ENTERPRISE PRODUCTS PARTNERS Total Assets as on June-2020 is 61,944 Million USD","7,000",A. James Teague
222,208,61.32 Billion USD,Russia,"Energy, Oil and Gas, Natural Gas Generation, Petroleum",NOVATEK Annual Revenues for December-2019 ending is 862.8 Billion RUB,NOVATEK Annual Net Income for December-2019 ending is 865.4 Billion RUB,,"16,821",Leonid Viktorovich Mikhelson
223,209,61.30 Billion USD,Germany,"Consumer Cyclical, Automobile, Cars, Trucks, Commercial Vehicles, Passenger Vehicles, Electric Vehicle Charging Station",DAIMLER AG Annual Revenues for December-2019 ending is 172.74 Billion EUR,DAIMLER AG Annual Net Income for December-2019 ending is 2.37 Billion EUR,,"288,481",Ola Kallenius
224,210,60.89 Billion USD,China,"Consumer Cyclical, eCommerce, Internet or Mobile App Based Business, Retail, Consumer Services",JD.COM Annual Revenues for December-2020 ending is 745.8 Billion CNY,49.4 Billion CNY for Year ending December-2020,422.28 Billion CNY as on December-2020,"310,000",Liu Qiangdong
225,211,60.88 Billion USD,USA,"Real Estate, Property Investments, Commercial Properties, Consumer Services, Investments, Retail","SIMON PROPERTY GROUP Annual Revenues for December-2019 ending is 5,755 Million USD","SIMON PROPERTY GROUP Annual Net Income for December-2019 ending is 2,101 Million USD","SIMON PROPERTY GROUP Total Assets as on June-2020 is 34,026 Million USD","3,300",David Simon
226,211,60.81 Billion USD,China,"Financial Services, Banking Services","PSBC (POSTAL SAVINGS BANK OF CHINA) Annual Revenues as on December-2019 ending period is 145,579 Million CNY","PSBC (POSTAL SAVINGS BANK OF CHINA) Annual Net Income as on December-2019 ending period is 58,432 Million CNY",,"194,527",Lv Jiajin
227,212,60.60 Billion USD,"Australia, New Zealand","Financial Services, Banking Services, Asset Management, Wealth Management, Credit Cards",WESTPAC BANKING CORPORATION Annual Revenues for September-2020 ending is 19.89 Billion AUD,WESTPAC BANKING CORPORATION Annual Net Income for September-2020 ending is 2.28 Billion AUD,WESTPAC BANKING CORPORATION Total Assets as on 2020-Sep is 911.9 Billion AUD,"36,849",Peter King
228,213,60.29 Billion USD,Indonesia,"Financial Services, Banking Services, Credit Cards","PT BANK CENTRAL ASIA TBK Annual Revenues for December-2019 ending is 72,968 Billion IDR","PT BANK CENTRAL ASIA TBK Annual Net Income for December-2019 ending is 28,565 Billion IDR",,"26,123",Jahja Setiaatmadja
229,214,59.95 Billion USD,USA,"Consumer Defensive, FMCG, Personal Care Products, Consumer Non Durables","COLGATE-PALMOLIVE COMPANY Annual Revenues for December-2019 ending is 15,693 Million USD","COLGATE-PALMOLIVE COMPANY Annual Net Income for December-2019 ending is 2,367 Million USD","COLGATE-PALMOLIVE COMPANY Total Assets as on June-2020 is 15,141 Million USD","34,200",Noel R. Wallace
230,215,59.88 Billion USD,USA,"Industries, Aerospace Products, Defense Products, Electronics, Space Products, Missiles, Satellites, Sensors, Rockets, Machinery Manufacturing, Software and IT, Software Products, Capital Goods, Aerospace and Defense, Manufacturing","NORTHROP GRUMMAN CORPORATION Annual Revenues for December-2019 ending is 33,841 Million USD","NORTHROP GRUMMAN CORPORATION Annual Net Income for December-2019 ending is 2,248 Million USD","44,469  Million USD as on December 2020","97,000",Kathy Warden
231,216,59.70 Billion USD,India,"Financial Services, Banking Services, Asset Management, Insurance",HDFC Consolidated Annual Revenues for March-2020 ending is 1017.25 Billion INR,HDFC Consolidated Annual Net Income for March-2020 ending is 170.80 Billion INR,,"3,226",Keki M Mistry
232,217,58.92 Billion USD,USA,"Real Estate, Infrastructure, Cell Towers Infrastructure, Consumer Services, Property Investments","CROWN CASTLE INTERNATIONAL CORPORATION Annual Revenues for December-2019 ending is 5,763 Million USD",CROWN CASTLE INTERNATIONAL CORPORATION Annual Net Income for December-2019 ending is 860 Million USD,,"4,900",Jay A. Brown
233,218,58.78 Billion USD,China,"Financial Services, Banking Services",INDUSTRIAL BANK Annual Revenues for December-2019 ending is 181.1 Billion CNY,INDUSTRIAL BANK Annual Net Income for December-2019 ending is 65.8 Billion CNY,,"60,500","Doyle Mitchell, Jr."
234,219,58.76 Billion USD,UK,"Financial Services, Banking Services",LLOYDS BANKING GROUP Annual Revenues for December-2019 ending is 41.08 Billion GBP,LLOYDS BANKING GROUP Annual Net Profit for year ending December-2019 is 3006 Million GBP,LLOYDS BANKING GROUP Total Assets as on December-2019 is 833893 Million GBP,"61,576",Charlie Nunn
235,220,58.44 Billion USD,India,"Consumer Defensive, FMCG, Food Products, Personal Care Products, Consumer Goods",HINDUSTAN UNILEVER Annual Revenue for Mar-2019 ending year : 387 Billions INR,HINDUSTAN UNILEVER Annual Net Profit for Mar-2019 ending year : 60 Billions INR,"HINDUSTAN UNILEVER Total Assets 67,652 Crores INR as on Sep 2020 (Consolidated)","21,000",Sanjiv Mehta
236,221,58.28 Billion USD,China,"Technology, Electrical Products, Refrigerators, Electronics, Home Furnishing",MIDEA GROUP Annual Revenues for December-2019 ending is 278.2 Billion CNY,MIDEA GROUP Annual Net Income for December-2019 ending is 24.2 Billion CNY,,"149,239",Paul Fang
237,222,58.25 Billion USD,Canada,"Financial Services, Investments, Property Investments, Asset Management, Consumer Services",BROOKFIELD ASSET MANAGEMENT Annual Revenues for December-2019 ending is 91.70 Billion CAD,BROOKFIELD ASSET MANAGEMENT Annual Net Income for December-2019 ending is 3.72 Billion CAD,,"150,000",Bruce Flatt
238,223,57.94 Billion USD,UK,"Consumer Defensive, FMCG, HealthCare Products, Consumer Non Durables, Consumer Goods",RECKITT BENCKISER GROUP Annual Revenue for year ending December-2019 is 12846 Million GBP,RECKITT BENCKISER GROUP Annual Net Loss for year ending December-2019 is -3670 Million GBP,RECKITT BENCKISER GROUP Total Assets as on December-2019 is 32139 Million GBP,"39,553",Laxman Narasimhan
239,224,57.91 Billion USD,China,"Financial Services, Banking Services",BANK OF COMMUNICATIONS Annual Revenues for December-2019 ending is 231.7 Billion CNY,BANK OF COMMUNICATIONS Annual Net Income for December-2019 ending is 77.3 Billion CNY,,"84,740",Deqi Ren
240,225,57.75 Billion USD,USA,"Industries, Machinery Manufacturing, Automobile Parts, Home Appliances, Electrical Products, Electronics, Adhesives, Technology, Construction Materials, Automobile, Manufacturing, Industry Machinery","ILLINOIS TOOL WORKS Annual Revenues for December-2019 ending is 14,109 Million USD","ILLINOIS TOOL WORKS Annual Net Income for December-2019 ending is 2,521 Million USD","ILLINOIS TOOL WORKS Total Assets as on June-2020 is 14,263 Million USD","43,000",Ernest Scott Santi
241,226,57.46 Billion USD,France,"Power Equipment, Automation, Building Automation, Industrial Automation, Industrial Electrical Electronics, Power Management Tools, Tools and Equipment, Industry Machinery, Lighting Products, Electric Vehicle Charging Station",SCHNEIDER ELECTRIC Annual Revenues for December-2019 ending is 27.15 Billion EUR,SCHNEIDER ELECTRIC Annual Net Income for December-2019 ending is 2.41 Billion EUR,,"155,466",Jean-Pascal Tricoire
242,227,57.25 Billion USD,USA,"Healthcare, Pharmaceutical, Biotechnology, Biopharmaceutical, HealthCare Products, Technology","VERTEX PHARMACEUTICALS Annual Revenues for December-2019 ending is 4,163 Million USD","VERTEX PHARMACEUTICALS Annual Net Income for December-2019 ending is 1,177 Million USD","VERTEX PHARMACEUTICALS Total Assets as on June-2020 is 10,216 Million USD","3,400",Reshma Kewalramani
243,228,57.18 Billion USD,China,"Technology, Electrical Products, Electronics, Air Conditioners, Home Appliances, Refrigerators, Mobiles, Mobiles & Accessories, Electronics, Consumer Electronics",GREE ELECTRIC APPLIANCES Annual Revenues for December-2019 ending is 198.15 Billion CNY,GREE ELECTRIC APPLIANCES Annual Net Income for December-2019 ending is 24.7 Billion CNY,,"88,846",Dong Mingzhu
244,229,57.11 Billion USD,USA,"Power Equipment, Mobiles & Accessories, Semiconductors","APPLIED MATERIALS Annual Revenues for December-2019 ending is 14,608 Million USD","APPLIED MATERIALS Annual Net Income for December-2019 ending is 2,706 Million USD",,"24,000",Gary E. Dickerson
245,230,56.98 Billion USD,Italy,"Energy, Oil and Gas, Natural Gas Generation, Petroleum, Electricity Generation, Oil Refining, Power Generation, Nuclear Power",ENI S.P.A. Annual Revenues for December-2019 ending is 69.88 Billion EUR,ENI S.P.A. Annual Net Income for December-2019 ending is 0.148 Billion EUR,,"31,495",Claudio Descalzi
246,231,56.89 Billion USD,China,"Utilities, Electricity Generation, Electric Utilities, Energy",CHINA YANGTZE POWER Annual Revenues for December-2019 ending is 49.87 Billion CNY,CHINA YANGTZE POWER Annual Net Income for December-2019 ending is 21.54 Billion CNY,,"4,077",Lei Mingshan
247,232,56.81 Billion USD,USA,"Energy, Oil and Gas, Oil Field Services","SCHLUMBERGER Annual Revenues for December-2019 ending is 32,917 Million USD","SCHLUMBERGER Annual Net Loss for December-2019 ending is (-)10,137 Million USD (Loss)","SCHLUMBERGER Total Assets as on June-2020 is 44,667 Million USD","86,000",Olivier Le Peuch
248,233,56.53 Billion USD,USA,"Financial Services, Healthcare Service, Insurance, Investments","MARSH & MCLENNAN COMPANIES Annual Revenues for December-2019 ending is 16,652 Million USD","MARSH & MCLENNAN COMPANIES Annual Net Income for December-2019 ending is 1,742 Million USD","MARSH & MCLENNAN COMPANIES Total Assets as on June-2020 is 32,169 Million USD","76,000",Daniel S. Glaser
249,234,56.45 Billion USD,USA,"Industries, Rail Transport, Real Estate, Transportation, Railway","CSX CORPORATION Annual Revenues for December-2019 ending is 11,937 Million USD","CSX CORPORATION Annual Net Income for December-2019 ending is 3,331 Million USD","CSX CORPORATION Total Assets as on June-2020 is 38,904 Million USD","19,300",James M. Foote
250,235,56.23 Billion USD,USA,"Real Estate, Property Investments, Investments, Consumer Services","PROLOGIS Annual Revenues for December-2019 ending is 3,330 Million USD","PROLOGIS Annual Net Income for December-2019 ending is 1,573 Million USD",,"1,945",Hamid Moghadam
251,236,55.86 Billion USD,USA,"Technology, Technology Hardware and Instruments, Processors / Chips, Semiconductors, Electronics","ADVANCED MICRO DEVICES (AMD) Annual Revenues for December-2019 ending is 6,731 Million USD",ADVANCED MICRO DEVICES (AMD) Annual Net Income for December-2019 ending is 341 Million USD,"ADVANCED MICRO DEVICES (AMD) Total Assets as on June-2020 is 6,583 Million USD","12,600",Lisa Su
252,237,55.71 Billion USD,South Korea,"Technology, Semiconductors, Electronics, Memory Products, Processors / Chips, Technology Hardware and Instruments","SK HYNIX Annual Revenues for December-2019 ending is 26,990 Billion KRW","SK HYNIX Annual Net Income for December-2019 ending is 2,013 Billion KRW",,"29,008",Lee Seok-Hee
253,238,55.62 Billion USD,USA,"Industries, Aerospace Products, Defense Products, Aeroplane, Weapons, Security Systems and Solutions, Weapons, Marine Systems, Marine Transportation, Transportation, Capital Goods, Aerospace and Defense, Space Products","GENERAL DYNAMICS CORPORATION Annual Revenues for December-2019 ending is 39,350 Million USD","GENERAL DYNAMICS CORPORATION Annual Net Income for December-2019 ending is 3,484 Million USD",,"104,000",Phebe Novakovic
254,239,55.33 Billion USD,USA,"Basic Materials, Chemicals, Scientific Research Products, Professional Services","ECOLAB Annual Revenues for December-2019 ending is 14,906 Million USD","ECOLAB Annual Net Income for December-2019 ending is 1,559 Million USD","ECOLAB Total Assets as on June-2020 is 18,082 Million USD","50,200","Douglas M. Baker, Jr"
255,240,55.32 Billion USD,USA,"Industries, Agriculture Machinery, Construction Equipment, Commercial Vehicles, Engineering Products, Automobile, Machinery Manufacturing, Capital Goods, Manufacturing, Heavy Machinery","DEERE & COMPANY Annual Revenues for December-2019 ending is 38,941 Million USD","DEERE & COMPANY Annual Net Income for December-2019 ending is 3,253 Million USD","DEERE & COMPANY Total Assets as on July-2020 is 77,264 Million USD","69,600",John C. May
256,241,55.30 Billion USD,USA,"Industries, Digital Payment Solution Services, Software and IT, Software Products, Business Services","GLOBAL PAYMENTS Annual Revenues for December-2019 ending is 4,912 Million USD",GLOBAL PAYMENTS Annual Net Income for December-2019 ending is 430.6 Million USD,"GLOBAL PAYMENTS Total Assets as on June-2020 is 44,001 Million USD","24,000",Jeffrey S. Sloan
257,242,55.27 Billion USD,Australia,"Financial Services, Banking Services","NATIONAL AUSTRALIA BANK Annual Revenues for September-2020 ending is 16,422 Million AUD","NATIONAL AUSTRALIA BANK Annual Net Income for September-2020 ending is 2,520 Million AUD",866.5 Billion AUD Total Assets as on 2020-Sep,"34,841",Ross McEwan
258,243,54.76 Billion USD,Saudi Arabia,"Communication Services, Telecom",SAUDI TELECOM COMPANY (STC) Annual Revenues for December-2019 ending is 54.36 Billion SAR,SAUDI TELECOM COMPANY (STC) Annual Net Income for December-2019 ending is 10.66 Billion SAR,,"17,000",Nasser bin Suleiman Al-Nasser
259,244,54.61 Billion USD,USA,"Technology, Cloud Services, Software and IT, Software Products, Artificial Intelligence","SERVICENOW Annual Revenues for December-2019 ending is 3,460 Million USD",SERVICENOW Annual Net Income for December-2019 ending is 626.6 Million USD,"SERVICENOW Total Assets as on June-2020 is 6,521.309 Million USD","11,000",Bill McDermott
260,245,54.38 Billion USD,USA,"Basic Materials, Paints and Coatings, Construction Materials, Retail, Consumer Services, Chemicals","SHERWIN-WILLIAMS COMPANY Annual Revenues for December-2019 ending is 17,900 Million USD","SHERWIN-WILLIAMS COMPANY Annual Net Income for December-2019 ending is 1,541 Million USD","SHERWIN-WILLIAMS COMPANY Total Assets as on June-2020 is 20,494 Million USD","61,031",John G. Morikis
261,245,,UK,"Financial Services, Consulting Services, Business Services, Professional Services, Accounting and Auditing",ERNST & YOUNG annual revenues for 2019 is 36.4 Billion USD,,,"312,250",
262,246,54.38 Billion USD,USA,"Consumer Cyclical, Hotels, Consumer Services","LAS VEGAS SANDS CORP Annual Revenues for December-2019 ending is 13,739 Million USD","LAS VEGAS SANDS CORP Annual Net Income for December-2019 ending is 2,698 Million USD","LAS VEGAS SANDS CORP Total Assets as on June-2020 is 21,695 Million USD","51,500",Sheldon Adelson
263,247,54.29 Billion USD,China,"Healthcare, Pharmaceutical, Biotechnology, HealthCare Products, Technology",JIANGSU HENGRUI MEDICINE Annual Revenues for December-2019 ending is 23.28 Billion CNY,JIANGSU HENGRUI MEDICINE Annual Net Income for December-2019 ending is 5.33 Billion CNY,,"24,500",
264,248,54.24 Billion USD,Mexico,"Communication Services, Telecom, Fixed Line Service, Mobile Services, Internet Providers, Television Services, Internet of Things, Utilities, Telecom Equipment",AMERICA MOVIL Annual Revenues for December-2019 ending is 1007.3 Billion MXN,AMERICA MOVIL Annual Net Income for December-2019 ending is 67.7 Billion MXN,,"186,851",Daniel Hajj Aboumrad
265,249,54.03 Billion USD,Germany,"Consumer Cyclical, Automobile, Cars, Luxury Goods, Passenger Vehicles",BAYERISCHE MOTOREN WERKE (BMW) Annual Revenues for December-2019 ending is 104.21 Billion EUR,BAYERISCHE MOTOREN WERKE (BMW) Annual Net Income for December-2019 ending is 4.91 Billion EUR,,"120,726",
266,250,53.83 Billion USD,China,"Real Estate, Construction",CHINA VANKE Annual Revenues for December-2019 ending is 367.89 Billion CNY,CHINA VANKE Annual Net Income for December-2019 ending is 38.87 Billion CNY,,"140,565",Yu Liang
267,251,53.72 Billion USD,Switzerland,"Consumer Defensive, FMCG, Food Products, Non-Alcoholic Beverages, Beverages, Dairy Products, Food and Beverage, Package Foods",DANONE Annual Revenues for December-2019 ending is 25.28 Billion EUR,DANONE Annual Net Income for December-2019 ending is 1.93 Billion EUR,,"98,854",Emmanuel Faber
268,252,53.41 Billion USD,USA,"Consumer Cyclical, Automobile, Cars, Automobile Parts, Capital Goods, Passenger Vehicles","GENERAL MOTORS COMPANY Annual Revenues for December-2019 ending is 137,237 Million USD","GENERAL MOTORS COMPANY Annual Net Income for December-2019 ending is 6,732 Million USD","GENERAL MOTORS COMPANY Total Assets as on June-2020 is 237,535 Million USD","155,000",Mary Barra
269,253,53.28 Billion USD,Switzerland,"Industries, Electronics, Electrical Products, Engineering Products, Technology Hardware and Instruments, Automation, Robotics, Consumer Durables, Technology, Electric Vehicle Charging Station",ABB Annual Revenues for December-2019 ending is 27.97 Billion EUR,ABB Annual Net Income for December-2019 ending is 1.44 Billion EUR,,"20,900",Bjorn Rosengren
270,254,53.05 Billion USD,USA,"Healthcare, Pharmacy, Healthcare Service, Retail, HealthCare Products","WALGREENS BOOTS ALLIANCE Annual Revenues for August-2019 ending is 136,866 Million USD","WALGREENS BOOTS ALLIANCE Annual Net Income for August-2019 ending is 3,982 Million USD",,"277,000",Stefano Pessina
271,255,53.03 Billion USD,China,"Communication Services, Internet or Mobile App Based Business, Software and IT, Software Products, Artificial Intelligence, Advertising, Media, Technology, Social Media",BAIDU Annual Revenues for December-2019 ending is 107.4 Billion CNY,BAIDU Annual Net Income for December-2019 ending is 2.06 Billion CNY,,"41,000",Robin Li
272,256,52.75 Billion USD,Mexico,"Consumer Defensive, Retail, Super Markets, Hypermarkets",WAL-MART DE MEXICO Annual Revenues for December-2019 ending is 646.8 Billion MXN,WAL-MART DE MEXICO Annual Net Income for December-2019 ending is 37.89 Billion MXN,,"239,000",Guilherme Loureiro
273,256,,Germany,"Retail, Super Markets, Hypermarkets",ALDI Annual Revenues of 2020 is 53 Billion EUR,,,"25,000",
274,257,52.68 Billion USD,Germany,"Healthcare, Pharmaceutical, Chemicals, HealthCare Products",MERCK KGAA O.N. Annual Revenues for December-2019 ending is 16.15 Billion EUR,MERCK KGAA O.N. Annual Net Income for December-2019 ending is 1.32 Billion EUR,,"58,096",Stefan Oschmann
275,258,52.61 Billion USD,Canada,"Financial Services, Banking Services",BANK OF MONTREAL Annual Revenues for October-2019 ending is 25.33 Billion CAD,BANK OF MONTREAL Annual Net Income for October-2019 ending is 5.54 Billion CAD,,"43,360",Darryl White
276,259,52.32 Billion USD,Canada,"Energy, Oil and Gas, Infrastructure, Electricity Generation, Power Generation, Natural Gas Generation, Oil and Gas Pipeline Transport, Utilities, Gas Utilities, Electric Utilities",TC ENERGY CORPORATION Annual Revenues for December-2019 ending is 13.25 Billion CAD,TC ENERGY CORPORATION Annual Net Income for December-2019 ending is 4.14 Billion CAD,76.56 Billion USD as Dec 2019,"7,283",Russell K. Girling
277,260,51.93 Billion USD,UK,"Communication Services, Telecom, Mobile Services, Fixed Line Service, Internet Providers, Television Services, Utilities, Telecom Equipment",VODAFONE GROUP Annual Revenue for year ending March-2020 is 44974 Million EUR,VODAFONE GROUP Annual Net Loss for year ending March-2020 is -455 Million EUR,VODAFONE GROUP Total Assets as on March-2020 is 168168 Million EUR,"105,000",Nick Read
278,261,51.62 Billion USD,China,"Energy, Mining, Coal Mining",CHINA SHENHUA ENERGY COMPANY Annual Revenues for December-2019 ending is 241.87 Billion CNY,CHINA SHENHUA ENERGY COMPANY Annual Net Income for December-2019 ending is 43.25 Billion CNY,,"76,182",Yang Jiping
279,262,51.61 Billion USD,USA,"Financial Services, Commodities Trading, Stock Markets, Trading, Capital Markets, Investments, Trading","INTERCONTINENTAL EXCHANGE Annual Revenues for December-2019 ending is 6,547 Million USD","INTERCONTINENTAL EXCHANGE Annual Net Income for December-2019 ending is 1,933 Million USD",,"8,890",Jeffrey C. Sprecher
280,263,51.58 Billion USD,USA,"Technology, Transportation, Consumer Services, Software and IT, Software Products, Ride Sharing","UBER TECHNOLOGIES Annual Revenues for December-2019 ending is 14,147 Million USD","UBER TECHNOLOGIES Annual Net Income for December-2019 ending is (-)8,506 Million USD (Loss)",,"22,800",Dara Khosrowshahi
281,264,51.54 Billion USD,Japan,"Financial Services, Banking Services","SUMITOMO MITSUI FINANCIAL GROUP Annual Revenues for March-2020 ending is 3,677 Billion JPY",SUMITOMO MITSUI FINANCIAL GROUP Annual Net Income for March-2020 ending is 703.8 Billion JPY,,"86,800",Makoto Takashima
282,265,51.53 Billion USD,Japan,"Consumer Cyclical, Automobile, Bikes, Cars, Capital Goods, Passenger Vehicles","HONDA MOTOR Annual Revenues for March-2020 ending is 14,931 Billion JPY",HONDA MOTOR Annual Net Income for March-2020 ending is 455.7 Billion JPY,,"211,374",Takahiro Hachigo
283,266,51.51 Billion USD,USA,"Basic Materials, Chemicals, Industrial Gases","AIR PRODUCTS AND CHEMICALS Annual Revenues for September-2019 ending is 8,919 Million USD","AIR PRODUCTS AND CHEMICALS Annual Net Income for September-2019 ending is 1,760 Million USD",,"19,275",Seifi Ghasemi
284,267,51.32 Billion USD,Qatar,"Financial Services, Banking Services, Asset Management, Securities, Credit Cards, Insurance",QATAR NATIONAL BANK Annual Revenues for December-2019 ending is 25.12 Billion QAR,QATAR NATIONAL BANK Annual Net Income for December-2019 ending is 13.35 Billion QAR,,"28,000",Abdulla Mubarak Al-Khalifa
285,268,51.24 Billion USD,China,"Financial Services, Banking Services",SHANGHAI PUDONG DEVELOPMENT BANK Annual Revenues for December-2019 ending is 189.04 Billion CNY,SHANGHAI PUDONG DEVELOPMENT BANK Annual Net Income for December-2019 ending is 58.91 Billion CNY,,"58,200",Ji Xiaohui
286,269,51.09 Billion USD,China,"Technology, Electronics, Processors / Chips, Technology Hardware and Instruments, Communications Equipment",FOXCONN INDUSTRIAL INTERNET Annual Revenues for December-2019 ending is 408.6 Billion CNY,FOXCONN INDUSTRIAL INTERNET Annual Net Income for December-2019 ending is 18.6 Billion CNY,,"803,126",
